{
  "meta": {
    "version": "1.1.0",
    "generatedAt": "2026-01-17T12:00:00Z",
    "root": "d:\\Dokument\\GitHub\\Lekbanken\\lekbanken-main",
    "notes": [
      "Independent analysis by Claude per INVENTORY_PLAYBOOK.md",
      "Focused on file-level granularity, not directory grouping",
      "Security-critical areas (auth, billing, GDPR, tenant) marked unknown unless evidence strong"
    ]
  },
  "nodes": [
    {
      "id": "layout:app/layout.tsx",
      "type": "layout",
      "name": "Root Layout",
      "path": "app/layout.tsx",
      "ownerDomain": "shared",
      "status": {
        "usage": "used_runtime",
        "confidence": 0.95,
        "evidence": [
          {"kind": "route_reachability", "detail": "Root layout used by all routes"}
        ]
      },
      "guards": [],
      "risk": "low",
      "notes": "Root application layout, wraps all pages.",
      "runtime_scope": "prod",
      "exposure": "public"
    },
    {
      "id": "layout:app/(marketing)/layout.tsx",
      "type": "layout",
      "name": "Marketing Layout",
      "path": "app/(marketing)/layout.tsx",
      "ownerDomain": "marketing",
      "status": {
        "usage": "used_runtime",
        "confidence": 0.9,
        "evidence": [
          {"kind": "route_reachability", "detail": "Used by all marketing routes"}
        ]
      },
      "guards": [],
      "risk": "low",
      "notes": "Layout for public marketing pages.",
      "runtime_scope": "prod",
      "exposure": "public"
    },
    {
      "id": "layout:app/(marketing)/auth/layout.tsx",
      "type": "layout",
      "name": "Auth Layout",
      "path": "app/(marketing)/auth/layout.tsx",
      "ownerDomain": "marketing",
      "status": {
        "usage": "used_runtime",
        "confidence": 0.9,
        "evidence": [
          {"kind": "route_reachability", "detail": "Used by auth routes"}
        ]
      },
      "guards": [],
      "risk": "medium",
      "notes": "Layout for authentication pages. Security-critical.",
      "runtime_scope": "prod",
      "exposure": "public"
    },
    {
      "id": "layout:app/admin/layout.tsx",
      "type": "layout",
      "name": "Admin Layout",
      "path": "app/admin/layout.tsx",
      "ownerDomain": "admin",
      "status": {
        "usage": "used_runtime",
        "confidence": 0.9,
        "evidence": [
          {"kind": "route_reachability", "detail": "Used by all admin routes"},
          {"kind": "role_gate", "detail": "Requires admin role"}
        ]
      },
      "guards": ["requireAdmin"],
      "risk": "high",
      "notes": "Admin dashboard layout. Requires authentication and admin role.",
      "runtime_scope": "prod",
      "exposure": "admin_only"
    },
    {
      "id": "layout:app/admin/(system)/layout.tsx",
      "type": "layout",
      "name": "System Admin Layout",
      "path": "app/admin/(system)/layout.tsx",
      "ownerDomain": "admin",
      "status": {
        "usage": "used_runtime",
        "confidence": 0.85,
        "evidence": [
          {"kind": "route_reachability", "detail": "Used by system admin routes"},
          {"kind": "role_gate", "detail": "Requires system_admin role"}
        ]
      },
      "guards": ["requireSystemAdmin"],
      "risk": "high",
      "notes": "System-level admin layout. Highest privilege level.",
      "runtime_scope": "prod",
      "exposure": "admin_only"
    },
    {
      "id": "layout:app/admin/tenant/[tenantId]/layout.tsx",
      "type": "layout",
      "name": "Tenant Admin Layout",
      "path": "app/admin/tenant/[tenantId]/layout.tsx",
      "ownerDomain": "admin",
      "status": {
        "usage": "used_runtime",
        "confidence": 0.85,
        "evidence": [
          {"kind": "route_reachability", "detail": "Used by tenant-scoped admin routes"},
          {"kind": "tenant_gate", "detail": "Requires tenant membership"}
        ]
      },
      "guards": ["requireTenantAdmin"],
      "risk": "high",
      "notes": "Tenant-scoped admin layout.",
      "runtime_scope": "prod",
      "exposure": "tenant_scoped"
    },
    {
      "id": "layout:app/app/layout.tsx",
      "type": "layout",
      "name": "App Layout",
      "path": "app/app/layout.tsx",
      "ownerDomain": "app",
      "status": {
        "usage": "used_runtime",
        "confidence": 0.9,
        "evidence": [
          {"kind": "route_reachability", "detail": "Used by authenticated app routes"}
        ]
      },
      "guards": ["requireAuth"],
      "risk": "medium",
      "notes": "Main authenticated app layout.",
      "runtime_scope": "prod",
      "exposure": "authenticated"
    },
    {
      "id": "layout:app/app/profile/layout.tsx",
      "type": "layout",
      "name": "Profile Layout",
      "path": "app/app/profile/layout.tsx",
      "ownerDomain": "app",
      "status": {
        "usage": "used_runtime",
        "confidence": 0.85,
        "evidence": [
          {"kind": "route_reachability", "detail": "Used by profile routes"}
        ]
      },
      "guards": ["requireAuth"],
      "risk": "medium",
      "notes": "User profile section layout. Contains PII.",
      "runtime_scope": "prod",
      "exposure": "authenticated"
    },
    {
      "id": "layout:app/legal/layout.tsx",
      "type": "layout",
      "name": "Legal Layout",
      "path": "app/legal/layout.tsx",
      "ownerDomain": "shared",
      "status": {
        "usage": "used_runtime",
        "confidence": 0.9,
        "evidence": [
          {"kind": "route_reachability", "detail": "Used by legal pages"}
        ]
      },
      "guards": [],
      "risk": "low",
      "notes": "Layout for legal documents (privacy, terms, etc.).",
      "runtime_scope": "prod",
      "exposure": "public"
    },
    {
      "id": "layout:app/legal/accept/layout.tsx",
      "type": "layout",
      "name": "Legal Accept Layout",
      "path": "app/legal/accept/layout.tsx",
      "ownerDomain": "shared",
      "status": {
        "usage": "used_runtime",
        "confidence": 0.85,
        "evidence": [
          {"kind": "route_reachability", "detail": "Used by legal acceptance flow"}
        ]
      },
      "guards": [],
      "risk": "medium",
      "notes": "Legal acceptance flow. GDPR-relevant.",
      "runtime_scope": "prod",
      "exposure": "authenticated"
    },
    {
      "id": "layout:app/sandbox/layout.tsx",
      "type": "layout",
      "name": "Sandbox Layout",
      "path": "app/sandbox/layout.tsx",
      "ownerDomain": "sandbox",
      "status": {
        "usage": "used_runtime",
        "confidence": 0.8,
        "evidence": [
          {"kind": "route_reachability", "detail": "Used by sandbox routes"},
          {"kind": "flag_gate", "detail": "dev_only or feature flag gated"}
        ]
      },
      "guards": ["devOnly"],
      "risk": "low",
      "notes": "Sandbox/dev testing layout.",
      "runtime_scope": "dev_only",
      "exposure": "internal"
    },
    {
      "id": "layout:app/sandbox/auth-demo/layout.tsx",
      "type": "layout",
      "name": "Auth Demo Layout",
      "path": "app/sandbox/auth-demo/layout.tsx",
      "ownerDomain": "sandbox",
      "status": {
        "usage": "dormant_flagged",
        "confidence": 0.7,
        "evidence": [
          {"kind": "flag_gate", "detail": "Sandbox route, likely dev_only"}
        ]
      },
      "guards": ["devOnly"],
      "risk": "low",
      "notes": "Auth demo layout in sandbox.",
      "runtime_scope": "dev_only",
      "exposure": "internal"
    },
    {
      "id": "route:app/(marketing)/page.tsx",
      "type": "route",
      "name": "Marketing Home",
      "path": "app/(marketing)/page.tsx",
      "ownerDomain": "marketing",
      "status": {
        "usage": "used_runtime",
        "confidence": 0.95,
        "evidence": [
          {"kind": "route_reachability", "detail": "Public landing page"}
        ]
      },
      "guards": [],
      "risk": "low",
      "notes": "Public marketing homepage.",
      "runtime_scope": "prod",
      "exposure": "public"
    },
    {
      "id": "route:app/(marketing)/auth/login/page.tsx",
      "type": "route",
      "name": "Login Page",
      "path": "app/(marketing)/auth/login/page.tsx",
      "ownerDomain": "marketing",
      "status": {
        "usage": "used_runtime",
        "confidence": 0.95,
        "evidence": [
          {"kind": "route_reachability", "detail": "Login entry point"}
        ]
      },
      "guards": [],
      "risk": "high",
      "notes": "Authentication login page. Security-critical.",
      "runtime_scope": "prod",
      "exposure": "public"
    },
    {
      "id": "route:app/(marketing)/auth/signup/page.tsx",
      "type": "route",
      "name": "Signup Page",
      "path": "app/(marketing)/auth/signup/page.tsx",
      "ownerDomain": "marketing",
      "status": {
        "usage": "used_runtime",
        "confidence": 0.95,
        "evidence": [
          {"kind": "route_reachability", "detail": "Signup entry point"}
        ]
      },
      "guards": [],
      "risk": "high",
      "notes": "User registration page. Security-critical.",
      "runtime_scope": "prod",
      "exposure": "public"
    },
    {
      "id": "route:app/(marketing)/auth/reset-password/page.tsx",
      "type": "route",
      "name": "Reset Password Page",
      "path": "app/(marketing)/auth/reset-password/page.tsx",
      "ownerDomain": "marketing",
      "status": {
        "usage": "used_runtime",
        "confidence": 0.9,
        "evidence": [
          {"kind": "route_reachability", "detail": "Password reset flow"}
        ]
      },
      "guards": [],
      "risk": "high",
      "notes": "Password reset page. Security-critical.",
      "runtime_scope": "prod",
      "exposure": "public"
    },
    {
      "id": "route:app/(marketing)/features/page.tsx",
      "type": "route",
      "name": "Features Page",
      "path": "app/(marketing)/features/page.tsx",
      "ownerDomain": "marketing",
      "status": {
        "usage": "used_runtime",
        "confidence": 0.85,